Nome,Preco,Imagem,Categoria
Ração Seca Nutrilus Pro+ Frango & Carne para Cães Adultos de Raças Médias e Grandes,175.86,https://www.petlove.com.br/images/products/267509/product/%2820%29_Ra%C3%A7%C3%A3o_Seca_Nutrilus_Pro__Frango___Carne_para_C%C3%A3es_Adultos_2.jpg?1680129321,Racoes
Ração Seca Nutrilus Pro+ Frango & Carne para Cães Sênior,137.52,https://www.petlove.com.br/images/products/250512/product/2617011_FRENTE.jpg?1635780697,Racoes
Ração Royal Canin Maxi Adult para Cães Adultos Grandes a partir de 15 Meses de Idade,319.27,https://www.petlove.com.br/images/products/208594/product/Ra%C3%A7%C3%A3o_Royal_Canin_Maxi_Adult_para_C%C3%A3es_Adultos_Grandes_a_partir_de_15_Meses_de_Idade_3105317.jpg?1627668785,Racoes
Ração Seca Suprema Sabor Carne para Cães Adultos,127.92,https://www.petlove.com.br/images/products/283461/product/31027535567.jpg?1718801971,Racoes
Ração Premier Golden Formula Cães Adultos Frango e Arroz Mini Bits,150.20,https://www.petlove.com.br/images/products/265990/product/Ra%C3%A7%C3%A3o_Seca_PremieR_Pet_Golden_Formula_C%C3%A3es_Adultos_Frango_e_Arroz_Mini_Bits_-_15_Kg_31021721-3_1.jpg?1674059936,Racoes
Ração Seca Nutrilus Pro+ Frango & Carne para Cães Adultos de Raças Pequenas,129.52,https://www.petlove.com.br/images/products/267815/product/Ra%C3%A7%C3%A3o_Seca_Nutrilus_Pro__Frango___Carne_para_C%C3%A3es_Adultos_de_Ra%C3%A7as_Pequenas_!.jpg?1681215307,Racoes
Ração Seca Nutrilus Light Frango para Cães Adultos Raças Médias e Grande,137.52,https://www.petlove.com.br/images/products/275743/product/31027528671_Ra%C3%A7%C3%A3o_Seca_Nutrilus_Light_Frango_para_C%C3%A3es_Adultos_Ra%C3%A7as_M%C3%A9dias_e_Grande.jpg?1700689579,Racoes
Ração Seca PremieR Pet Golden Power Training Cães Filhotes Frango e Arroz - 15 Kg,161.90,https://www.petlove.com.br/images/products/261625/product/Ra%C3%A7%C3%A3o_Seca_PremieR_Pet_Golden_Power_Training_C%C3%A3es_Filhotes_Frango_e_Arroz_-_15_Kg_3108210.jpg?1662029934,Racoes
Ração Royal Canin Medium Adult para Cães Adultos de Raças Médias a partir de 12 Meses de Idade,319.27,https://www.petlove.com.br/images/products/208592/product/Ra%C3%A7%C3%A3o_Royal_Canin_Medium_Adult_para_C%C3%A3es_Adultos_de_Ra%C3%A7as_M%C3%A9dias_a_partir_de_12_Meses_de_Idade_3105503.jpg?1627668779,Racoes
Ração Seca Magnus Todo Dia Carne para Cães Adultos,130.41,https://www.petlove.com.br/images/products/266482/product/Ra%C3%A7%C3%A3o_Seca_Magnus_Todo_Dia_Carne_para_C%C3%A3es_Adultos_311810.jpg?1676296086,Racoes
